{
  "schemaVersion": 1,
  "planKind": "checkpointCreate",
  "planId": "22222222-2222-4222-8222-222222222222",
  "createdAt": "2026-07-14T10:00:00Z",
  "expiresAt": "2026-07-14T10:15:00Z",
  "hostFingerprint": "aaaaaaaaaaaaaaaaaaaaaaaaaaaaaaaaaaaaaaaaaaaaaaaaaaaaaaaaaaaaaaaa",
  "vmId": "vm-1",
  "vmName": "clean-win11",
  "ownershipId": "33333333-3333-4333-8333-333333333333",
  "vmFingerprint": "bbbbbbbbbbbbbbbbbbbbbbbbbbbbbbbbbbbbbbbbbbbbbbbbbbbbbbbbbbbbbbbb",
  "checkpointName": "00-stock-clean",
  "checkpointInventoryFingerprint": "cccccccccccccccccccccccccccccccccccccccccccccccccccccccccccccccc",
  "checkpointNameAbsent": true
}
